Kitchen,School,Date,Menu,Projected_Kids,Actual_Meals_Served,Successful_Taps,F4E_Supported_Kids,Teachers,Staff_Meals,Failed_Taps,New_Registrations,New_Tags_Replaced,Rice_Remaining,B_W_G_Remaining,Missed_Food,Next_Day_Projection_Students,Next_Day_Projection_Teachers,Next_Day_Projection_Staff,Start_Taping,Stop_Taping,Projection_Comment,Comment_1,Comment_2,Comment_3,Comment_4,Reported_By
,Kindiga Primary & Junior Secondary School,2026-01-07,Rice and Western.,160,153,134,19,0,2,13,1,2,00,0,,180,00,,"7 Jan 2026, 12:40:31","7 Jan 2026, 13:20:41",,The food was delicious,Lines were well managed with the help of deputy.,"The no of failed taps was 13 higher than yesterday's 5,this is resulted by the system recognising some Grade 9 students as Graduated.",Actual meals increased to 153 from 145 yesterday..students are still reporting back to school.,@James Mbugua SC Kindiga Primary
,Githioro Primary School,2026-01-07,White rice and western,280,277,254,23,0,2,14,4,2,0,0,,300,0,,"7 Jan 2026, 12:35:41","7 Jan 2026, 13:53:47",,Food was appetising,Line management was organised assisted by TOD,"Failed taps increased from yesterdayâ€™s 12 to 14 today, parents forgot to top up their accounts on time","Successful taps increased from yesterdayâ€™s 259 to 277 today, kids are turning up well to school.",@GITHIORO COMPREHENSIVE
,Kiambururu Comprehensive School,2026-01-07,White Rice and Western,250,244,216,28,0,3,5,4,6,3,3,,270,0,,"7 Jan 2026, 12:25:58","7 Jan 2026, 13:30:04",,The food was hot and delicious,Line management was smooth and fast,Failed taps decreased from 8 to 5.We still had parents who Failed to top up on time,Actual meals served increased from 225 to 244.More students reported back to school today,@Kiambururu Comprehensive School
,Catholic Archdiocese Of Nairobi Gataka Primary & Junior Secondary,2026-01-07,Rice and Western,260,245,222,23,1,2,21,6,5,4,5,,260,2,,"7 Jan 2026, 12:42:26","7 Jan 2026, 13:40:54",,The food was delicious,The queue was well managed by the school coordinator.,"The number of failed taps rose from 20 to 21, parents failed to make timely payments for their kids.","The number of actual meals rose from 221 to 245, some Grade 7 kids reported back today.",@Catholic archdiocese of Nairobi Gataka primary school and Junior secondary
,Kiambururu Secondary School,2026-01-07,White rice with western,100,133,133,0,0,3,3,0,0,0,0,,140,0,,"7 Jan 2026, 13:40:54","7 Jan 2026, 14:43:02",,The food was delicious students enjoyed the meal,line management was smooth,"failed taps today was 3 been the first day of opening school, some parents to top up",successful taps was 133 been the day of opening school,@Salome-kiambururu secondary school
,Mathanja Priamry School,2026-01-07,rice and western,200,162,143,19,0,2,3,3,3,10,11,,175,0,,"7 Jan 2026, 12:30:13","7 Jan 2026, 13:30:22",,food was delicious,I managed the queue without any assistance,today we had 3 failed taps an increase compared to yesterday 1. some parents didn't top-up their accounts on time.,today we had 162 actual meals served an increase by 1 compared to yesterday. some new students reported today,@mathanja primary school
,Githiga Primary,2026-01-07,White rice and Western,330,318,287,31,0,3,21,2,7,1,2,,300,0,,"7 Jan 2026, 12:30:51","7 Jan 2026, 13:30:55",,Food was sweet and delicious,Lines Management was smooth,Failed taps increased  from21 to 22.Parents forgot  to top up their accounts.,Actual meals increased  from 286 to 318.turn out was good.,@Nicholas-SC - Githiga Comprehensive
,GATHAITHI PRIMARY,2026-01-07,White rice and western,400,403,370,33,0,3,50,9,3,00,0,,460,5,,"7 Jan 2026, 12:40:56","7 Jan 2026, 13:50:01",,food was good,TOD assisted with queue management,We had 50 failed taps a rise from 21. Some parents failed to top up on time.,Successful taps increased from 351 to 403,@P.C.E.A Gathaithi primary and Junior secondary school@Dennis Macharia clicked Submit and confirmed by
,Gatina Primary School,2026-01-07,white rice and Western,400,391,339,52,0,3,12,19,6,2,3,,410,0,,"7 Jan 2026, 12:31:02","7 Jan 2026, 15:30:13",,food was delicious,line was smooth and orderly,failed taps were 12 a decrease from yesterday's number of 19. More parents managed to credit accounts on time,Actual meals served were 391 an increase from yesterday's number of 338. More accounts had sufficient funds and turn up was high.,@Kang'ethe Dennis
,PCEA Matuguta Secondary School,2026-01-07,White Rice & Western,80,82,82,0,0,2,4,0,0,00,0,,90,00,,"7 Jan 2026, 12:50:00","7 Jan 2026, 13:10:24",,Food was hot and delicious,Queues were orderly and well managed by the help of the tod,Number of failed taps today increased from 03 yesterday to 04 today,Successful taps today were 82 higher in comparison to the projected meals that were 80 and also higher than yesterday's 74,@Njeri -Matuguta secondary school
,Gitiha Secondary School,2026-01-07,White rice and western stew,80,75,75,0,0,2,0,0,0,10,10,,80,0,,"7 Jan 2026, 12:39:02","7 Jan 2026, 13:11:38",,Food was hot and of desired temperatures,The queue was manageable by help from the teacher on duty,"There was no failed taps, improvement noted",The number had decreased since students were sent home for school fees,@Hannah Mbugua
,Ihiga Primary,2026-01-07,Rice and Western,160,153,140,12,0,2,0,6,3,02,5,,150,0,,"7 Jan 2026, 12:40:45","7 Jan 2026, 13:20:55",,Food was Delicious,Queues were manageable,Today's failed taps was 0 a decrease from yesterday's number which was 6.I reached out to parents with insufficient funds to top up.,Successful taps was 153 the same as yesterday's number which was 153.Today's turn up was as yesterday's.,@Naomi SC-Ihiga Comprehensive
,Gatitu Primary,2026-01-07,RICE AND WESTERN.,350,316,291,25,1,3,12,3,8,6,8,,340,1,,"7 Jan 2026, 12:00:49","7 Jan 2026, 13:50:56",,Food was well cooked and enough for all.,Lines moved from class to class under ToD's cordinance.,An increase from 7 to 12 today which was highly resulted by accounts having insufficient or no funds at all..,Successful taps also decreased from 296 to 291 resulted by parents not making timely payments.,@Wambui ikonya -sc- Gatitu comprehensive
,PCEA Matuguta Primary & Junior Secondary School,2026-01-07,Rice and western,440,428,398,30,2,3,13,5,7,3,4,,440,2,,"7 Jan 2026, 12:40:06","7 Jan 2026, 13:40:12",,Food was delicious,Queue was well managed,Failed taps were 13 an increase of 4 taps from yesterday's 9 taps. Respective parents had not topped up,Actual meals were 428  an increase of 21 taps from yesterday's 407 actual meals . Some of the absent students reported and also there were new registrations .,@Matuguta primary
,Gitombo Primary School,2026-01-07,White rice and Western,180,168,156,12,0,2,5,1,0,3,4,,170,0,,"7 Jan 2026, 12:30:02","7 Jan 2026, 13:30:16",,Food was delicious students enjoyed,Queue was manageable,Today failed tap was 5 an increase of 3 from 2 yesterday parents didn't top up account on time.,Actual meals served today was 168 an increase of 1 from 167 yesterday students show up well today.,@Veronica Mwaura -S/C- Gitombo primary
,Githima Primary,2026-01-07,white rice and western,210,196,172,24,0,2,6,1,5,4,4,,200,4,,"7 Jan 2026, 12:40:17","7 Jan 2026, 13:40:24",,The food was delicious,I managed the queue and the kids were disciplined today.,We had 6 failed taps which is an increase from yesterday's 4 failed taps.Some accounts were not topped up on time.,We had 196 actual meals served which is an increase from yesterday's 177 actual meals served.The turn out was higher today.,@Brenda kamawe Githima primary and junior secondary school
,Gathangari Primary School,2026-01-07,Rice and western,380,306,271,25,0,3,55,5,9,10,10,,360,0,,"7 Jan 2026, 12:50:23","7 Jan 2026, 14:00:36",,Food was delicious,Queue was smoothly managed by the teacher,Failed taps increased from 19to 55.Parents did not top up on time while Grade 9 tags stating the kid has graduated,I successful taps decreased from 331 to 306.some parents did not top up on time.,@Pauline Gatimu
,Kiawairia Primary,2026-01-07,Rice and western,130,125,110,15,2,2,4,2,2,1,2,,130,2,,"7 Jan 2026, 12:00:53","7 Jan 2026, 13:30:21",,Food was delicious,Lines were neat  and ordely,We had 4 failed taps same as yesterday some parents didn't top up on time,We had 110  successful taps an increase from yesterday 102 students have reported fully,@Mary kimani SC kiawairia comprehensive school
,Kiawairia Secondary School,2026-01-07,White rice and western,50,41,41,0,0,2,2,0,0,3,3,,25,0,,"7 Jan 2026, 12:05:44","7 Jan 2026, 12:20:51",,Food was delicious and appetizing,Line management was transitioning good assisted by TOD,failed taps were  2 being on an opening day,Actual meals were 41 bring on an opening day,@Patrick Kariuki Kiawaria secondary school Tapper
,Gathiruini Primary School,2026-01-07,Rice and western,240,199,179,20,0,2,25,1,4,10,12,,230,0,,"7 Jan 2026, 12:30:55","7 Jan 2026, 13:30:07",,Lunch was delicious,Line management was good with help of teacher on duty,Failed taps today were 25 an increase 7 this is because parents didn't top up their accounts on time,Actual meal today were 199 a decrease from 225 this is because parents didn't top up their accounts on time,@Catherine Wanjiru
,Kahunira Secondary School,2026-01-07,Pilau rice & western ndengu,150,98,98,0,0,3,15,0,0,7,5,0,120,0,3,"7 Jan 2026, 13:10:44","7 Jan 2026, 13:50:35",Expecting students will continue,Food was tasty,Queue was well managed by TOD,"Failed taps increased from 3 to 19, respective parents didn't top up","Actual meals served today decreased from 103 to 98,some students didn't turn up for tapping.",@ANTHONY
,Kahunira Comprehensive School,2026-01-07,Pilau Rice & Western Ndengu,600,611,558,53,0,4,31,18,20,,0,0,660,0,4,"7 Jan 2026, 12:40:48","7 Jan 2026, 13:45:57",We are expecting a slight increase tomorrow as students continue,Food was delicious and at good temperatures.,Queue management was well executed by TOD,"Failed taps increased from 19 to 31, respective parents didn't top up.","Actual meals served today increased from513 to 611,as students continue reopening and registration of new students.",@Mwangi Mary Kahunira Comprehensive
,Githunguri Technical & Secondary School,2026-01-07,Rice& western stew,140,109,109,0,0,2,3,0,3,9.3,10.8,0,140,0,2,"7 Jan 2026, 13:30:59","7 Jan 2026, 13:58:22",More students expected as most will have,Meals were hot and delicious,Queue was manageable and fast moving,More students compared to yesterday,Students who hadn't paid for their meals had done so on time,@Mercy Njeri Nyambura
,Kiababu Primary School,2026-01-07,Masala rice and western,250,250,224,26,0,2,9,4,4,0,0,0,260,0,2,"7 Jan 2026, 12:40:47","7 Jan 2026, 13:20:53",Expecting more kids to,The food was delicious,Queue was neat with the help of the teacher on duty,Failed taps decreased from 13 to 9 as most parents managed to pay on Time,Successful taps increased from 230 to 250 as most parents managed to pay on Time,@kiaibabu primary school
,Ciiko Primary,2026-01-07,Masala rice and western,700,646,608,38,0,5,17,58,32,10,15,0,740,0,5,"7 Jan 2026, 13:00:04","7 Jan 2026, 14:00:57",Tomorrow we expected about 100 news comer will be admitted to school tomorrow also we expected the turnout To increase,The food was hot and delicious,The queue was managed by teacher on duty,Failed taps  increased from 8 to 17,Increased from 433 to 646,@Ciiko Comprehensive school -SL- Samy Migwi
,Kiawaiguru Primary School,2026-01-07,Rice and Western,210,186,169,17,2,2,6,4,4,6,7,,200,2,,"7 Jan 2026, 12:30:00","7 Jan 2026, 13:30:00",,Lunch was delicious.,Line was oderly.,Failed taps decreased from yesterday’s 7 to today 6.A parent topped up.,Actual meals served increased from yesterday’s 180 to today 186.More pupils reported to school today.,@KIAWAIGURU PRIMARY SCHOOL
,Gathaithi Secondary School,2026-01-07,Rice and western,90,90,90,0,0,2,11,0,5,,0,,95,0,,"7 Jan 2026, 13:20:47","7 Jan 2026, 14:14:12",,Food was delicious,The queue was managed,Failed taps increased as many parents didn't top-up early,Successful taps were more than yesterday,@Joseph mburu nga'ang'a
,Gikang'a Kageche Secondary School,2026-01-07,White Rice and Western,180,77,77,0,0,6,4,0,0,30,29,,120,0,,"7 Jan 2026, 13:15:29","7 Jan 2026, 13:35:40",,Food was delicious,Queue was well managed by the TOD,Today's failed taps decreased from 7 to 4.,Today's successful taps decreased from 147 to 77.stident were sent back home for school fees,@Pauline Gatimu
,Mukuyu Secondary School,2026-01-07,Rice and western,200,187,187,0,0,0,5,0,2,14,5,,200,0,,"7 Jan 2026, 12:40:18","7 Jan 2026, 13:22:29",,Food was delicious,Queue managed was good,Today failed taps were five because some parents failed to top up their account,Today's actual tap was 187 and it was opening day,@Kanyore Comprehensive School
,Kanyore Primary School,2026-01-07,Rice and Western,530,505,473,32,0,3,48,5,7,16,8,,550,0,,"7 Jan 2026, 12:40:00","7 Jan 2026, 13:53:00",,Food was delicious,Queue was well managed,Today’s failed taps were 48 which is more than yesterday’s 35,The number of actual taps were 505 which is more than yesterday’s 462 because the turn up was higher.,@Kanyore Comprehensive School
