Kitchen,School,School_Type,Date,Menu,Rice_variant,Projected_Kids,Actual_Meals_Served,Successful_Taps,F4E_Supported_Kids,Teachers,Staff_Meals,Failed_Taps,New_Registrations,New_Tags_Replaced,Rice_Remaining,B_W_G_Remaining,Missed_Food,Next_Day_Projection_Students,Next_Day_Projection_Teachers,Next_Day_Projection_Staff,Start_Taping,Stop_Taping,Lunch_Time_Min,Projection_Comment,Comment_1,Comment_2,Comment_3,Comment_4,Reported_By
kiambu kitchen,Ciiko Primary,Primary,2026-01-06,Rice and Beans,White,380,433,400,33,0,5,8,0,35,0.0,0,20.0,700,0,5.0,2026-01-06 13:00:21,2026-01-06 14:00:34,60,"Tomorrow we shall  Grade 1 ,Grade 7 and Newcomers will   be admitted  thus  we expected a higher number.",The food was hot  and delicious,The queue was managed by the teacher on duty,Failed taps increased from 1 to 8,Successful taps increased from 72 to 433,@Ciiko Comprehensive school -SL- Samy Migwi
kiambu kitchen,Kahunira Primary,Primary,2026-01-06,Rice and Beans,White,580,513,468,45,0,4,19,42,4,7.0,7,0.0,600,0,4.0,2026-01-06 12:40:59,2026-01-06 13:40:14,59,We are projecting this number because grade 7 will be,Food was delicious,Queue management was well managed by TOD,"Failed taps decreased from 25 to 19,some parents made timely payment","Actual meals served today increased from 412 to 513 meals, turn out was great today.",@Mwangi Mary Kahunira Comprehensive
kiambu kitchen,Kiababu Primary,Primary,2026-01-06,Rice and Beans,White,350,230,206,24,0,2,13,0,0,30.0,36,12.0,250,0,2.0,2026-01-06 12:40:18,2026-01-06 14:15:28,95,Expecting more kids to,The food was delicious,Queue management was neat with the help of the teacher on duty,Failed taps increased from 11 to 13 as some parents did not manage to pay on time,Successful taps increased from 166 to 230 more kids reported today,@kiaibabu primary school
Githunguri,Mathanja Priamry,Primary,2026-01-06,Rice and Beans,White,150,161,141,20,0,2,1,6,4,0.0,0,,200,0,,2026-01-06 12:20:38,2026-01-06 13:15:44,55,,food was delicious,I managed the queue without any assistance,today we had only 1 failed tap a decrease compared to yesterday 6. parents remembered to top up their accounts.,today we had 161 actual meals served an increase compared to yesterday 100. more kids reported to school today.,@mathanja primary school
Githunguri,Gatina Primary,Primary,2026-01-06,Rice and Beans,White,310,338,290,48,0,3,19,13,8,0.0,0,,400,0,,2026-01-06 12:40:15,2026-01-06 14:30:01,110,,food was delicious,line was smooth and orderly,Failed taps were 19 an increase from yesterday's number of 14. A number of parents didn't manage to credit accounts on time,"Actual meals served were 338 an increase from yesterday's number of 264,  these was due  to high number of kids who reported back to school and parents managed to credit accounts on time.",@Kang'ethe Dennis
Githunguri,Ihiga Primary,Primary,2026-01-06,Rice and Beans,White,150,153,142,11,0,2,6,3,6,0.0,0,,150,0,,2026-01-06 12:40:26,2026-01-06 13:20:06,40,,Food was Enough,Queues were manageable with assistance from teacher on duty,Today's failed taps was 6 a decrease of 1 from yesterday's which was 7,Successful taps was 153 an increase from yesterday's which was 127.Pp1 kids are continuing to register and some kids who were absent reported back today.,@Naomi SC-Ihiga Comprehensive
Githunguri,Githima Primary,Primary,2026-01-06,Rice and Beans,White,180,177,161,16,0,2,4,1,4,1.0,1,,200,0,,2026-01-06 12:42:59,2026-01-06 12:40:05,-3,,The food was delicious,I managed the queue and the kids were disciplined today,We had 4 failed taps which is a decrease from yesterday's 13 failed taps.Most accounts were topped up today.,We had 177 actual meals served which is an increase from yesterday's 126 actual meals served.The turn out was high today.,@Brenda kamawe Githima primary and junior secondary school
Githunguri,Githiga Primary,Primary,2026-01-06,Rice and Beans,White,270,286,252,34,0,3,21,11,3,0.0,0,,330,0,,2026-01-06 12:30:56,2026-01-06 13:45:02,74,,Food was sweet and delicious,Line Management was smooth,Failed taps increased from 18 to 21...parents forgot to top up their accounts.,Actual meals increased from 177 to 286.Students turnout  increased.,@Nicholas-SC - Githiga Comprehensive
Githunguri,Kiawaiguru Primary,Primary,2026-01-06,Rice and Beans,White,200,180,164,16,1,2,7,0,2,5.0,6,,200,2,,2026-01-06 12:30:00,2026-01-06 13:30:00,60,,Food was delicious.,Queue transitioned from class to class.,Failed taps decreased from yesterday’s 9 to today 7.Few parents managed to top up.,Actual meals served increased from yesterday’s 142 to today 180.Most pupils reported to school today.,@KIAWAIGURU PRIMARY SCHOOL
Githunguri,Kindiga Primary,Primary,2026-01-06,Rice and Beans,White,140,145,129,16,0,2,5,4,0,0.0,0,,150,0,,2026-01-06 12:20:45,2026-01-06 13:20:57,60,,The food was Hot and Tasty,Queues transitioned smoothly .,"The no of failed taps was 5,parents did not top up accounts.","The no of actual meals served was 145,some kids are still reporting back to school.",@James Mbugua SC Kindiga Primary
Githunguri,Kanyore Primary,Primary,2026-01-06,Rice and Beans,White,500,462,434,28,0,3,35,22,14,47.0,11,,550,0,,2026-01-06 12:40:00,2026-01-06 13:50:00,70,,Food was delicious,Queue was well managed,The number of failed taps increased from 22 to 35 because more parents failed to top up the accounts.,The number of actual taps increased from 352 the previous day to 462 today because more accurate were topped up.,@Kanyore Comprehensive School
Githunguri,Kiambururu Primary,Primary,2026-01-06,Rice and Beans,White,230,225,198,27,0,3,8,3,3,1.0,1,,240,0,,2026-01-06 12:20:20,2026-01-06 13:33:31,73,,The food was delicious and hot,Line management was smooth and fast,Failed taps decreased from 9 to 8.Some parents did not top up,Actual taps increased from 167 to 225.The students are still reporting back to school,@Kiambururu Comprehensive School
Githunguri,Gitombo Primary,Primary,2026-01-06,Rice and Beans,White,150,167,152,15,0,2,2,4,2,0.0,0,,170,0,,2026-01-06 12:40:32,2026-01-06 13:40:44,60,,Food was yummy,Queue was manageable by the help of teacher on duty.,Today failed taps was 2 a decrease of 6 from yesterday which was 8 parents did top up on time.,Actual meal served today was 167 an increase of 41 from yesterday students show up well today.,@Veronica Mwaura -S/C- Gitombo primary
Githunguri,Gathaithi Primary,Primary,2026-01-06,Rice and Beans,White,380,351,322,29,0,3,22,0,0,7.0,8,,380,0,,2026-01-06 12:35:14,2026-01-06 13:50:27,75,,Food was great,Teachers on duty assisted with queue management,We had 22 failed taps a drop from 26.,We had 351 successful taps a rise from 263,@P.C.E.A Gathaithi primary and Junior secondary school
Githunguri,Gataka Primary,Primary,2026-01-06,Rice and Beans,White,220,221,195,26,0,2,20,7,2,0.0,0,,250,2,,2026-01-06 12:35:24,2026-01-06 13:35:40,60,,The food was delicious,The queue was well managed by the school coordinator,"The number of failed taps rose from 12 to 20, parents failed to make timely payments for their kids.","The number of actual meals rose from 176 to 221, more kids reported back to school today.",@Catholic archdiocese of Nairobi Gataka primary school and Junior secondary
Githunguri,Gatitu Primary,Primary,2026-01-06,Rice and Beans,White,330,324,296,28,0,3,7,10,6,2.0,2,,340,0,,2026-01-06 12:00:26,2026-01-06 13:50:36,110,,Food was delicious and well cooked.,Student were orderly and moved from class to class.,"Previous failed taps were 12 ,today 7 being a decrease...most of the accounts were funded and students present.",An increase from 252 to 324 which was resulted by student availing for tapping since most accounts had funds..,@Wambui ikonya -sc- Gatitu comprehensive
Githunguri,Gathiruini Primary,Primary,2026-01-06,Rice and Beans,White,240,225,200,25,0,2,7,5,3,4.0,5,,230,0,,2026-01-06 12:30:11,2026-01-06 13:30:18,60,,Lunch was delicious,Line management was good with help of teacher on duty,Failed taps today were 7 a decrease from 6 this is because parents didn't top up their accounts on time,Actual meals served today were 225 an increase from  179 this is because most students reported back to school,@Catherine Wanjiru
Githunguri,Matuguta Primary,Primary,2026-01-06,Rice and Beans,White,420,407,375,32,0,3,9,10,6,3.0,4,,440,2,,2026-01-06 12:30:36,2026-01-06 13:30:41,60,,Food was delicious,Queue was well managed,Failed taps were 9 a decrease of 16 taps from yesterday's 25 failed taps. The respective parents had not topped up.,Actual meals were 407 an increase of 102 taps from yesterday's 305 actual meals. Some of the  absent students reported to school today also some new students joined the school.,@Matuguta primary
Githunguri,Gikang'A Kageche Secondary,Secondary,2026-01-06,Rice and Beans,White,180,147,147,0,0,3,7,0,0,8.0,6,,180,0,,2026-01-06 13:10:39,2026-01-06 13:40:59,30,,Food was delicious and hot,Queue was well managed by the YOD,Today's failed taps was 7.parent didn't top up on time,Today's successful taps 147  a decrease from the projected which was 180,@Pauline Gatimu
Githunguri,Gathangari Primary,Primary,2026-01-06,Rice and Beans,White,330,331,267,29,0,3,19,16,8,10.0,0,,380,0,,2026-01-06 12:40:40,2026-01-06 13:40:52,60,,Food was delicious,Queue was smoothly managed by the T.OD,Failed increased slightly from 17 to 19.Parents did  not top up on time have urged kids to remind their parents.,Successful taps increased from 219 to 331.Kids turned up well in school and parents topped up on time,@Pauline Gatimu
Githunguri,Kiawairia Primary,Primary,2026-01-06,Rice and Beans,White,120,118,102,16,1,2,2,3,2,0.0,0,,125,3,,2026-01-06 12:00:21,2026-01-06 13:30:26,90,,Food was delicious,Lines were neat and ordely,We had 2 failed taps a decrease from yesterdays 4 some parents topped up on time,We had 102 successful taps an increase from 72 kids reported more today,@Mary kimani SC kiawairia comprehensive school
Githunguri,Gitiha Secondary,Secondary,2026-01-06,Rice and Beans,White,80,102,102,0,0,2,7,0,0,,0,,80,0,,2026-01-06 12:40:27,2026-01-06 13:18:07,38,,Food was delicious and of right temperatures,The queue was manageable,The number of failed taps decreased from the previous day,The number of successful taps increased from the previous day,@Hannah Mbugua
Githunguri,Matuguta Secondary,Secondary,2026-01-06,Rice and Beans,White,80,74,74,0,0,2,3,0,0,0.0,0,,80,0,,2026-01-06 12:40:43,2026-01-06 13:30:53,50,,Food was hot and delicious,Queues were orderly and well managed by the help of the tod,Number of failed taps today were 03,Successful taps today were 74 lower in comparison to the projected meals that were 80.,@Njeri -Matuguta secondary school
Githunguri,Githioro Primary,Primary,2026-01-06,Rice and Beans,White,250,259,239,20,0,2,12,11,1,0.0,0,,280,0,,2026-01-06 12:45:25,2026-01-06 13:45:30,60,,Food was appetising,Line management was organised assisted by the TOD,"Failed taps reduced from 16 to 12 , some parents remembered to top up their accounts","Successful taps increased from 201 to 259, kids reported fairly to school",@GITHIORO COMPREHENSIVE
Githunguri,Gathaithi Secondary,Secondary,2026-01-06,Rice and Beans,White,40,71,71,0,0,2,7,0,0,0.0,0,,90,0,,2026-01-06 01:13:26,2026-01-06 14:30:59,798,,Food was delicious,"With the help of the teacher on duty ,  we managed the queue",Most parents hadn't topped up,Actual meals were 71,@Joseph mburu nga'ang'a
kiambu kitchen,Githunguri Technical & Secondary,Secondary,2026-01-06,Rice and Beans,White,160,77,77,0,0,4,3,0,0,33.0,36,0.0,140,0,0.0,2026-01-06 13:30:24,2026-01-06 14:00:26,30,More students expected tomorrow second day of opening,Meal was hot and delicious,Queue was manageable,First day of opening,School resumed today,@Mercy Njeri Nyambura
kiambu kitchen,Kahunira Secondary,Secondary,2026-01-06,Rice and Beans,White,100,103,103,0,0,3,3,0,0,0.0,0,0.0,150,0,3.0,2026-01-06 13:20:54,2026-01-06 14:00:12,39,Am projecting 150 students because they will turn out tomorrow.,The food was delicious,The line was well managed by the school Captain,Today I 3 failed,Successful taps were 103,@ANTHONY
