Kitchen,School,Date,Menu,Projected_Kids,Actual_Meals_Served,Successful_Taps,F4E_Supported_Kids,Teachers,Staff_Meals,Failed_Taps,New_Registrations,New_Tags_Replaced,Rice_Remaining,B_W_G_Remaining,Missed_Food,Next_Day_Projection_Students,Next_Day_Projection_Teachers,Next_Day_Projection_Staff,Start_Taping,Stop_Taping,Projection_Comment,Comment_1,Comment_2,Comment_3,Comment_4,Reported_By
,Ciiko Primary,2026-01-13,Rice and Green grams,925,953,890,63,0,5,9,12,25,0,0,0,960,0,5,"13 Jan 2026, 12:30:07","13 Jan 2026, 14:10:24",We expect the same turnout as today thus projecting 960,Food was hot and delicious,The queue was managed by the teacher on duty,failed taps decreased from 22 to 9.,Successful taps increased from 850 to 890,@Ciiko Comprehensive school -SL- Samy Migwi
,Githunguri Technical & Secondary School,2026-01-13,Rice and green grams,190,150,150,0,0,2,1,7,7,15,18,0,170,0,2,"13 Jan 2026, 13:25:24","13 Jan 2026, 13:55:29",We expect a rise of successful taps tomorrow,Food was delicious and warm,Queue was well manageable,Failed taps today was 1 which is a constant compared yesterday 1 parents topped up,Actual meal served today was 150 which is a increase compared from 130 to 150 parents top up,"@Yvonne mugure, Githunguri Technical And Secondary School , Tapper"
,Kahunira Comprehensive School,2026-01-13,White Rice & Green Grams,685,690,637,56,0,4,13,4,8,5,5,0,690,0,4,"13 Jan 2026, 12:40:17","13 Jan 2026, 13:34:24",Normal school program,Food was hot and delicious.,Queue management was well executed by teacher on duty.,"Failed taps decreased from 21 to 13, respective parents made timely payment.","Actual meals served today increased from 665 to 690 meals served, majority of students turn out for tapping.",@Mwangi Mary Kahunira Comprehensive
,Kahunira Secondary School,2026-01-13,Rice & Green Gram,150,134,134,0,0,3,7,0,5,1,1.5,0,160,0,3,"13 Jan 2026, 13:00:37","13 Jan 2026, 13:30:41",Expecting grade 10 students to be,Food was hot and delicious,Queue was managed by the teacher,"Failed taps increased from 5 to 7, parents didn't top up their accounts","Meals served today increased from 131 to 134, grade 10 students are  reporting to school",@Tapper kahunira secondary
,Kiababu Primary School,2026-01-13,Rice and green grams,270,267,240,27,0,2,4,0,3,1,1,0,270,0,2,"13 Jan 2026, 12:40:37","13 Jan 2026, 13:30:47",Expecting more kids to,The food was delicious,Queue was neat with the help of the teacher on duty,Failed taps remained the same as some parents did not manage to pay on Time,Successful taps increased from 264 to 267 as most students reported today,@kiaibabu primary school
,Kiambururu Comprehensive School,2026-01-13,White Rice and GG,270,279,248,31,0,3,4,0,0,0,0,,290,0,,"13 Jan 2026, 12:30:53","13 Jan 2026, 13:40:00",,The food was hot and delicious,Line management was smooth and fast,Failed taps decreased from 13 to 4.Parents topped up on time.,Actual meals served increased from 262 to 279.Student turnout was high and there were few failed taps,@Kiambururu Comprehensive School
,Gathiruini Primary School,2026-01-13,Rice and Green grams,240,240,212,28,0,2,3,4,0,0,0,,245,0,,"13 Jan 2026, 12:30:55","13 Jan 2026, 13:30:06",,Lunch was delicious,Line management was good with help of teacher on duty,Failed taps today were 3 same as yesterday parents didn't top up their accounts on time,Actual meal served today were 240  an increase from 233 this is because most students were present today,@Catherine Wanjiru
,Gitiha Secondary School,2026-01-13,white rice and greengrams stew,130,121,121,0,0,2,5,2,10,2,3,,135,0,,"13 Jan 2026, 12:40:56","13 Jan 2026, 13:15:07",,the food was delicious and tasty,The queue was manageable by help of teacher on duty,The number of failed taps was not high,the number of successful taps had increased from the previous day,@Kang'ethe Dennis
,Githiga Primary,2026-01-13,Whiterice  and great grams,390,380,346,34,0,3,23,9,2,3,4,,385,0,,"13 Jan 2026, 12:30:35","13 Jan 2026, 13:58:40",,Food was sweet and delicious,Line Management was smooth,Failed taps increased from 19 to 23 . Some parents forgot to top up their accounts.,Actual  meals increased from  345 to 380. Students  turnout  increased  .Grad 7 reported.,@Nicholas-SC - Githiga Comprehensive
,Mukuyu Secondary School,2026-01-13,Rice and GG,260,227,227,0,0,0,11,2,9,16,16,,300,0,,"13 Jan 2026, 12:40:22","13 Jan 2026, 13:20:35",,Food was delicious,Queue was well managed,Mukuyu secondary school actual failed taps increases from 7 to 11 because some parents didn't top up,Mukuyu secondary school we had 227 actual taps which increases compared with yesterday which was 212.Grade 10 are still joining F4E,@Mukuyu Secondary School
,PCEA Matuguta Secondary School,2026-01-13,White Rice and Green grams,115,100,100,0,0,2,1,3,7,4.5,5.2,,110,00,,"13 Jan 2026, 13:50:27","13 Jan 2026, 13:48:37",,Food was hot and delicious,Queues were orderly and well managed by the help of the tod,Failed taps today were 01 lower compared to yesterday's 06,Successful taps today were 100 lower than the projected meals that were 115 but higher than yesterday's 95,@Njeri -Matuguta secondary school
,Kanyore Primary School,2026-01-13,Rice and green grams,620,619,576,43,0,0,10,5,3,10,0,,630,5,,"13 Jan 2026, 12:40:00","13 Jan 2026, 13:25:00",,Food was delicious,Queue was well managed,The number of failed taps reduced from yesterday’s 15 to today’s 10 because more accounts were topped up.,The number of actual taps increased from yesterday’s 609 to today’s 619 because more kids were present,@Kanyore Comprehensive School
,Gitombo Primary School,2026-01-13,White rice and Green grams,170,174,161,13,0,2,0,0,3,0,0,,175,0,,"13 Jan 2026, 12:40:52","13 Jan 2026, 13:14:59",,Food was delicious learners enjoyed.,Queue was well manageable.,Today failed tap was 0 a decrease of 2 from 2 yesterday  parents did the top up on time.,Actual meals served today was 174 an increase of 5 from 169 yesterday   more students reported well today.,@Veronica Mwaura -S/C- Gitombo primary
,Kiambururu Secondary School,2026-01-13,Rice with GG,180,178,178,0,0,3,3,11,10,1,2,,190,0,,"13 Jan 2026, 13:25:30","13 Jan 2026, 13:55:49",,The food was delicious students enjoyed the meal,line was smooth,"Failed taps today was 3 compared to previous which was 1, some parents forgot to top up.","Successful taps was 178 compared to previous which was 161, grade 10 reported today",@Salome-kiambururu secondary school
,Gatitu Primary,2026-01-13,RICE AND GREEN GRAMS.,375,379,347,32,1,3,8,2,6,00,0,,380,1,,"13 Jan 2026, 12:15:34","13 Jan 2026, 13:35:46",,Food was delicious .,Teacher on duty helped with line management... students moved orderly.,"Failed taps have decreased from 10 to 8 taps today,, parents that I called for top up adhered.",An increase in successful taps from 338 to 347.. Accounts had funds and students present.,@Wambui ikonya -sc- Gatitu comprehensive
,Gikang'a Kageche Secondary School,2026-01-13,Rice and Green Grams,230,231,231,0,0,3,4,4,9,0,0,,250,0,,"13 Jan 2026, 13:15:40","13 Jan 2026, 14:00:49",,Food was yummy,Queue was well managed,"Today's failed taps decreased from 9 to 4,parent topped up on time","Today's successful taps increased from 196 to 231,today's turn was high",@Pauline Gatimu
,Githima Primary,2026-01-13,White rice and greengrams,260,260,235,25,2,2,3,2,0,0,0,,260,4,,"13 Jan 2026, 12:30:42","13 Jan 2026, 13:30:48",,The food was delicious,I managed the queue and kids were disciplined today.,We had 3 failed taps which is a decrease from yesterday's 4 failed taps.Most accounts were topped up today.,We had 260 actual meals served which is an increase from yesterday's 256 actual meals served.The turn out was high and accounts were topped up on time.,@Brenda kamawe Githima primary and junior secondary school
,Gatina Primary School,2026-01-13,White rice and greengrams,450,442,384,58,0,3,7,2,1,0,0,,450,0,,"13 Jan 2026, 12:36:18","13 Jan 2026, 13:30:23",,food was hot and yummy,line was smooth and orderly,"failed taps were 7 similar with yesterday's number,more accounts maintained sufficient funds.","Actual meals served were 442 an increase compared to yesterday's number of 440, parents managed to credit accounts on time thus my actual meals number raises.",@Kang'ethe Dennis
,Gathangari Primary School,2026-01-13,White Rice and Green Grams,400,408,382,26,0,3,10,1,1,8,0,,410,0,,"13 Jan 2026, 12:20:40","13 Jan 2026, 13:38:51",,The food was delicious,The queue was well managed by the teacher,There was a decrease in number because most parents remembered to top up their accounts.,There was an increase in number because most accounts were topped up on time.,@PCEA GATHANGARI COMPREHENSIVE SCHOOL
,Mathanja Priamry School,2026-01-13,rice and green grams,195,194,174,20,0,2,1,6,2,0,0,,200,0,,"13 Jan 2026, 12:25:28","13 Jan 2026, 13:20:34",,food was delicious,I managed the queue without any assistance since kids were orderly.,today we had 1 failed tap same as yesterday. only one parent didn't top-up their account.,today we had 194 actual meals served an increase compared to yesterday 187. this is because we had new comers who reported today.,@mathanja primary school
,Catholic Archdiocese Of Nairobi Gataka Primary & Junior Secondary,2026-01-13,Rice and Greengrams,280,283,266,17,0,2,5,2,1,0,0,,285,0,,"13 Jan 2026, 12:45:23","13 Jan 2026, 13:34:30",,The food was delicious,The queue was well managed by the school coordinator.,"The number of failed taps dropped from 10 to 5, we reminded kids to request their parents to top up.","The number of actual meals rose from 272 to 283, parents made timely payments for their kids.",@Catholic archdiocese of Nairobi Gataka primary school and Junior secondary
,Gathaithi Secondary School,2026-01-13,Rice and green grams,100,94,94,0,0,2,4,0,5,1.8,2.1,,100,0,,"13 Jan 2026, 13:21:53","13 Jan 2026, 13:50:37",,Food was delicious,Queuing was good,We had 4 failed taps a rise from 2 due to failure of topping up,We had 94 successful taps a rise from yesterday's 74 due to more students attendance,@Joseph mburu nga'ang'a
,Kindiga Primary & Junior Secondary School,2026-01-13,Rice and GG,185,188,169,19,0,2,2,4,1,00,0,,190,00,,"13 Jan 2026, 12:40:06","13 Jan 2026, 13:30:14",,The food was delicious.,Queues were orderly.,"Failed taps decreased to 2 from yesterday's 4,some parents still did not top up accounts.","Successful taps increased to 188 from 179,Turn out was high and we also registered new students.",@James Mbugua SC Kindiga Primary
,GATHAITHI PRIMARY,2026-01-13,"RICE, GREENGRAMS AND BANANAS",460,457,411,46,0,3,13,2,1,00,0,,460,00,,"13 Jan 2026, 12:45:39","13 Jan 2026, 13:30:44",,Food was delicious,Teachers on duty assisted with queue management,We had 13 failed taps a drop from 16,Actual meals served increased from 447 to 457,@P.C.E.A Gathaithi primary and Junior secondary school Jane Wanjiru
,PCEA Matuguta Primary & Junior Secondary School,2026-01-13,Rice and greengrams,460,445,416,29,3,3,9,1,5,4,5,,450,3,,"13 Jan 2026, 12:40:51","13 Jan 2026, 13:30:58",,Food was delicious,Queue was well managed,failed taps were 9 a decrease of 7 taps from yesterday's 16 failed taps. Respective parents had not topped up,Actual meals were 445 a decrease of 8 taps from yesterday's 453 actual meals. Some parents had not topped up their  kid's accounts.,@Matuguta primary
,Kiawaiguru Primary School,2026-01-13,Rice and Green Grams,200,217,197,20,2,2,0,1,6,0,0,,220,2,,"13 Jan 2026, 12:30:00","13 Jan 2026, 13:25:00",,Lunch was delicious,Lunch was delicious,Failed taps decreased from yesterday’s 4 to today0.I called and reminded parents to top up before lunch time.,Actual meals served increased from yesterday’s 202 to today 217.Most pupils reported to school.,@KIAWAIGURU PRIMARY SCHOOL
,Ihiga Primary,2026-01-13,White Rice and Green Grams,165,165,154,11,0,2,0,1,0,0,0,,165,0,,"13 Jan 2026, 12:40:25","13 Jan 2026, 13:15:33",,Food was Enough,Queues were manageable with assistance from teacher on duty.,Failed taps were 0 the same as yesterday.parents are topping up their accounts on time.,Successful taps were 165 a decrease from yesterday's taps which was 167.Turn up was a bit lower than yesterday.,@Naomi SC-Ihiga Comprehensive
,Githioro Primary School,2026-01-13,White Rice  and Greengrams,313,322,297,25,0,2,7,1,0,2,0,,325,0,,"13 Jan 2026, 12:37:48","13 Jan 2026, 13:34:05",,Food was hot and appetising,Line management was organised assisted by tod.,"Failed taps reduced from 9 to 7, some parents  forgot to top up their accounts on time","Successful taps increased from 313 to 322,  most kids are back to school.",@GITHIORO COMPREHENSIVE
,Kiawairia Primary,2026-01-13,Rice and Greengrams,135,134,118,16,2,2,2,1,0,0,0,,135,2,,"13 Jan 2026, 12:00:19","13 Jan 2026, 13:30:25",,Food was hot and delicious,Lines were neat and ordely,We had 2 failed taps same as yesterday some parents didn't top up on time,We had 118 successful taps same as yesterday turn up was okay,@Mary kimani SC kiawairia comprehensive school
,Kiawairia Secondary School,2026-01-13,White rice and green grams,45,35,35,0,0,2,0,0,0,3,4,,50,0,,"13 Jan 2026, 13:20:16","13 Jan 2026, 13:30:29",,Food was delicious and appetizing,Line management was transitioning good,Number of failed taps remained 0 as of yesterday,Actual meals remained the same as of yesterday students haven't reported fully,@Patrick Kariuki Kiawaria secondary school Tapper
